{
  "contractVersion": "1.0.0",
  "transactionId": "7f3c2a8e-1d4b-4c6a-9e2f-0b5d8a1c3e7f",
  "organizationId": "0c9e4f21-5a7b-4d3e-8f1a-2b6c9d0e4a5b",
  "transactionType": "PAYMENT",
  "currency": "KES",
  "totalAmount": "125000.50",
  "accountContext": [
    {
      "accountId": "a1b2c3d4-e5f6-4a7b-8c9d-0e1f2a3b4c5d",
      "accountType": "EXPENSE",
      "side": "DEBIT"
    },
    {
      "accountId": "b2c3d4e5-f6a7-4b8c-9d0e-1f2a3b4c5d6e",
      "accountType": "ASSET",
      "side": "CREDIT"
    }
  ],
  "requestedBy": {
    "principalId": "user-4821",
    "principalType": "USER"
  },
  "requestedAt": "2026-09-23T09:15:00Z"
}
